69,jackwener/opencli,31840.0,下降19,浏览器自动化 / Web Agent,MIT,这是一个让 AI 更容易使用命令行或自动化系统接口的工具项目，适合做终端任务代理和自动执行。它解决的是自然语言到系统动作之间存在巨大落差的问题。适合开发、运维、批量任务处理和自动化工作台场景。
70,opendataloader-project/opendataloader-pdf,31420.0,下降19,文档解析 / PDF 与结构化抽取,Apache-2.0,这是一个面向 PDF 和文档数据提取的项目，适合做票据、报告、合同、论文和资料的结构化解析。它解决的是 PDF 内容难抽取、版式复杂、不适合直接进入 AI 流程的问题。适合知识库建设、文档问答和文档自动处理场景。
71,pascalorg/editor,31000.0,下降19,3D 生成 / CAD / 场景生成,MIT,这是一个偏 3D 编辑或空间内容处理的项目，适合做场景搭建、资产编辑和三维内容创作。它解决的是 3D 内容创作流程复杂、工具重、协作难的问题。适合游戏原型、空间设计和 3D 交互应用开发。
72,microsoft/BitNet,30580.0,下降19,NLP / LLM 训练与轻量模型,MIT,这是一个围绕轻量化大模型或高效推理的研究与工程项目，适合在有限算力环境下降低模型成本。它解决的是大模型部署昂贵、推理资源占用高的问题。适合做低成本推理、研究实验、边缘部署和模型压缩方向探索。
73,BerriAI/litellm,30160.0,下降19,LLM 网关 / 路由与代理层,MIT,这是一个统一不同大模型接口的网关层项目，适合在多个模型服务之间做切换、路由、配额和统一调用。它解决的是模型厂商 API 不兼容、成本和策略难统一管理的问题。适合平台团队建设统一 LLM 接入层和多模型治理体系。
74,Vaibhavs10/insanely-fast-whisper,29740.0,下降19,AI 语音 / 语音生成与识别,Apache-2.0,这是一个强调语音识别速度优化的项目，适合做实时字幕、转写和语音输入场景。它解决的是原始语音识别速度慢、资源开销大、难用于低延迟场景的问题。适合会议转写、音频检索、内容整理和语音交互产品。
75,saturndec/waoowaoo,29320.0,下降19,AI 视频生成 / 自动剪辑,MIT,这是一个偏视频生成或自动剪辑体验的项目，适合从脚本、素材或想法快速生成可传播的视频内容。它解决的是视频制作链条长、编辑成本高的问题。适合短视频、自媒体、产品推广和轻量视频内容工厂场景。
76,pinchtab/pinchtab,28900.0,下降19,浏览器自动化 / Web Agent,MIT,这是一个偏浏览器标签页和网页操作增强的项目，适合为 Web Agent 提供页面管理和自动交互能力。它解决的是多页面、多标签场景下自动化容易混乱的问题。适合网页任务执行、资料抓取、表单操作和基于浏览器的智能助手场景。
77,ChromeDevTools/chrome-devtools-mcp,28480.0,上升23,MCP Server / MCP 工具链,Apache-2.0,这是一个把 Chrome DevTools 能力暴露给 MCP/Agent 使用的工具链项目。它适合让 AI 理解和操作真实浏览器页面，解决“模型会说不会点、不会检查前端状态”的问题。适合前端调试、网页测试、自动化检查和浏览器代理任务。
78,gofr-dev/gofr,28060.0,下降19,AI 可观测 / LLM 评测,Apache-2.0,这是一个偏服务框架与可观测接入能力的项目，适合构建带指标、日志和结构化能力的 AI 服务。它解决的是 AI 服务上线后难排查、难治理和难标准化的问题。适合平台工程、AI 后端服务和需要工程化治理的生产场景。
79,jamiepine/voicebox,27640.0,下降19,文本转语音 / TTS,MIT,这是一个文本转语音项目，适合将文本快速转换成自然语音输出。它解决的是人工配音慢、批量生成语音成本高的问题。适合播客、教育内容、短视频配音和语音助手场景。
80,harry0703/MoneyPrinterTurbo,27220.0,下降19,AI 视频生成 / 自动剪辑,MIT,这是一个强调视频自动化生产效率的项目，适合批量生成短视频和营销类成片。它解决的是内容生产需要多人协作、流程繁琐的问题。适合增长团队、自媒体和需要高频输出视频的内容运营场景。
81,ysharma3501/LuxTTS,26800.0,下降19,文本转语音 / TTS,MIT,这是一个偏高质量语音输出的 TTS 项目，适合多场景语音合成和风格化配音。它解决的是传统 TTS 生硬、不自然、风格单一的问题。适合做数字人配音、教育播报、语音阅读和内容创作。
82,microsoft/markitdown,26380.0,下降19,文档解析 / PDF 与结构化抽取,MIT,这是一个把多种文档格式转成 Markdown 或结构化文本的项目，适合把复杂文档引入 LLM 工作流。它解决的是文档格式复杂、内容难直接送入模型理解的问题。适合知识库预处理、RAG 数据清洗、报告整理和文档自动化。
83,BIT-DataLab/Edit-Banana,25960.0,下降19,AI 图像生成 / 图像工作流,MIT,这是一个面向图像生成或编辑工作流的项目，适合做视觉创作、图像改写和素材处理。它解决的是设计流程依赖人工、生成与编辑工具分散的问题。适合创意设计、营销素材和图像实验场景。
84,hsliuping/TradingAgents-CN,25540.0,下降19,量化 / 金融 AI 代理,MIT,这是 TradingAgents 的中文化或本地化相关项目，适合中文用户理解和搭建金融研究型 Agent。它解决的是英文资料门槛高、金融代理实践难直接迁移的问题。适合本地研究、中文投资分析和金融 AI 教学场景。
85,supermemoryai/supermemory,25120.0,下降19,Agent 记忆 / 长上下文记忆,Apache-2.0,这是一个面向 AI 长期记忆和信息检索的项目，适合让助手记住历史对话、知识片段和用户偏好。它解决的是普通对话系统无法积累长期上下文的问题。适合个人助手、知识助理、客户关系维护和持续项目协作场景。
86,VectifyAI/PageIndex,24700.0,下降19,文档解析 / PDF 与结构化抽取,Apache-2.0,这是一个偏页面内容索引与结构化处理的项目，适合把网站或文档页面组织成可检索知识。它解决的是内容分散、信息难定位和后续问答命中率低的问题。适合搜索增强、知识库建设和面向 RAG 的数据准备。
87,virattt/dexter,24280.0,下降19,量化 / 金融 AI 代理,MIT,这是一个偏金融分析自动化或研究辅助的项目，适合用 AI 处理市场资料、形成分析观点和生成研究过程。它解决的是金融研究链路长、信息处理重复的问题。适合投资研究和自动化分析实验场景。
88,virattt/ai-hedge-fund,23860.0,下降19,量化 / 金融 AI 代理,MIT,这是一个将 AI 代理思路用于“对冲基金式研究工作流”的项目，适合做模拟研究团队协作和投资分析实验。它解决的是复杂投资研究需要多人角色配合、信息密集的问题。适合金融 AI 教学、研究框架搭建和策略思路验证。
89,tirth8205/code-review-graph,23440.0,下降19,MCP Server / MCP 工具链,MIT,这是一个帮助 AI 进行代码审查、关系理解或结构分析的项目，适合在大型仓库中建立代码依赖与审查视图。它解决的是代码审查只看局部、难理解系统关系的问题。适合研发团队做改动影响分析、代码评审辅助和工程知识导航。
90,builderz-labs/mission-control,23020.0,下降19,监控 / 趋势跟踪代理,MIT,这是一个偏统一控制台和持续监控的项目，适合把多个任务、多个代理或多个外部信号集中管理。它解决的是自动化系统一多就失去可见性的问题。适合任务监控、运行状态汇总和运营观察台场景。
91,huggingface/transformers,22600.0,上升5,计算机视觉 / OCR / 视觉生成,Apache-2.0,这是最常用的开源模型与推理框架之一，适合快速使用和集成大量 NLP、视觉、多模态模型。它解决的是模型接入成本高、不同模型接口不统一的问题。适合研究实验、产品原型和生产服务中的模型调用与微调场景。
92,vercel-labs/portless,22180.0,下降19,LLM 网关 / 路由与代理层,MIT,这是一个面向 LLM 接入层或中间代理的项目，适合在应用和模型之间增加一层统一管理。它解决的是多模型接入、鉴权、路由和策略管理复杂的问题。适合平台团队做统一模型服务出口和应用治理。
93,run-llama/liteparse,21760.0,下降19,文档解析 / PDF 与结构化抽取,Apache-2.0,这是一个轻量文档解析项目，适合快速从 PDF、文档或页面中抽取适合 LLM 使用的文本内容。它解决的是文档解析链路重、接入复杂的问题。适合轻量 RAG、文档问答和快速原型场景。
94,langflow-ai/openrag,21340.0,下降19,文档解析 / PDF 与结构化抽取,MIT,这是一个面向 RAG 场景的开源实现项目，适合把文档、网页或知识内容接入检索增强问答。它解决的是普通 LLM 容易胡编、缺少外部知识支撑的问题。适合企业知识库、FAQ、内部文档问答和研究资料查询场景。
95,Comfy-Org/ComfyUI,20920.0,下降19,AI 图像生成 / 图像工作流,GPL-3.0,这是一个节点式的图像生成与图像处理工作流平台。适合把扩散模型、控制网络、后处理、批量生成等步骤拼成可复用流程，解决出图链路复杂、参数难复用的问题。适合设计、素材工厂和视觉实验场景。
96,m1k1o/neko,20500.0,下降19,浏览器自动化 / Web Agent,Apache-2.0,neko 的核心方向是让 agent 驱动浏览器执行导航、表单和网页操作。这是一个定位较垂直或跨领域的项目，适合需要稳定浏览器执行能力的自动化场景。它主要解决页面交互型任务难标准化的问题，适合网页助手、自动操作和流程机器人。
97,PaddlePaddle/PaddleOCR,20080.0,下降19,计算机视觉 / OCR / 视觉生成,Apache-2.0,这是一个成熟的 OCR 与文档视觉理解工具链，适合票据、表格、合同、证照和复杂版面识别。它主要解决纸面或图片文字难结构化处理的问题。适合文档数字化、报销自动化、资料录入和视觉问答预处理场景。
98,nv-tlabs/kimodo,19660.0,下降19,3D 生成 / CAD / 场景生成,未知 / 未声明,kimodo 的核心方向是做 3D/CAD/建模与空间内容生成。这是一个定位较垂直或跨领域的项目，适合需要三维生成或空间建模能力的场景。它主要解决 3D 内容生成门槛高、试错慢的问题，适合研究实验和空间内容原型。
99,KittenML/KittenTTS,19240.0,下降19,文本转语音 / TTS,Apache-2.0,这是一个轻量语音合成项目，适合快速尝试本地或低成本语音输出能力。它解决的是很多 TTS 系统过重、上手门槛高的问题。适合原型验证、教育、轻量产品和本地实验。
100,dimensionalOS/dimos,18820.0,下降19,机器人 / Embodied AI,Apache-2.0,这是一个面向机器人或具身智能操作系统层的项目，适合组织传感器、动作控制和智能策略。它解决的是机器人系统组件繁杂、能力难统一的问题。适合机器人原型开发、实验平台和具身智能研究场景。
