排名,项目,热度分,对比上周排名变动,项目分类,项目 License,项目简介
1,anthropics/claude-code,98000.0,上升27,AI 编码助手 / Claude Code 能力增强,MIT,这是一个面向真实工程代码库的 AI 编码助手项目，适合在终端里完成读代码、改代码、补测试、重构和执行开发任务。它解决的是开发者在 IDE、命令行、文档和代码评审之间频繁切换的问题，让模型直接围绕仓库上下文工作。适合个人开发、代码修复、原型迭代和日常研发提效。
2,anomalyco/opencode,95500.0,新上榜,AI 编码助手 / Claude Code 能力增强,未知 / 未声明,这是本周涨势很强的开源编码代理项目，强调把 AI 从“回答问题”变成“直接参与开发”。适合处理需求拆解、代码修改、命令执行和连续交付类任务，解决单轮代码生成难以覆盖完整研发流程的问题。适合希望快速搭建本地或团队级编码代理工作流的开发者。
3,openai/codex,91500.0,新上榜,AI 编码助手 / Claude Code 能力增强,Apache-2.0,这是一个面向软件开发场景的 AI 编码项目，适合围绕仓库执行代码生成、修改、解释、验证和任务编排。它解决的是模型懂语法但不懂工程上下文、无法长期协作的问题。适合做开发提效、批量重构、自动修复和研发流程自动化。
4,block/goose,88800.0,新上榜,浏览器自动化 / Web Agent,Apache-2.0,这是一个让 AI 代理更稳定地调用工具、执行任务和连接外部环境的项目。它适合浏览器操作、系统调用和带状态任务执行，解决代理会规划但不会可靠落地的问题。适合做网页自动化、运维动作、研究任务和跨工具执行型助手。
5,langgenius/dify,85000.0,新上榜,LLM 基础设施 / 网关 / 推理,Apache-2.0,这是一个成熟的 LLM 应用开发平台，适合快速搭建聊天助手、RAG、工作流应用和多模型业务系统。它解决的是模型接入、流程编排、提示管理、知识库和部署链路过于分散的问题。适合平台团队、业务团队和需要快速交付 AI 应用的场景。
6,ollama/ollama,82000.0,新上榜,LLM 基础设施 / 网关 / 推理,MIT,这是一个本地模型运行平台，适合在个人电脑或私有环境中快速拉起和管理大模型。它解决的是本地推理部署门槛高、模型管理麻烦和调用方式不统一的问题。适合隐私敏感业务、离线实验、个人助理和轻量本地 AI 服务。
7,open-webui/open-webui,79500.0,新上榜,自托管 AI 助手 / 本地代理,BSD-3-Clause,这是一个流行的自托管 AI 前端与工作台，适合把本地或云端模型统一成可用的聊天和工具入口。它解决的是模型能跑但缺少好用界面、权限管理和多用户接入的问题。适合内部问答、团队使用、本地助手和私有部署场景。
8,ggml-org/llama.cpp,77200.0,新上榜,LLM 基础设施 / 网关 / 推理,MIT,这是一个高影响力的本地推理项目，适合在 CPU、边缘设备和受限环境中运行大模型。它解决的是模型推理成本高、对显卡依赖强的问题。适合本地部署、设备侧推理、嵌入式 AI 和性能优化场景。
9,langchain-ai/langchain,74800.0,新上榜,AI Agent / 工作流编排,MIT,这是一个广泛使用的 LLM 应用开发框架，适合把模型、工具、记忆、检索和工作流组合成完整应用。它解决的是 AI 应用链路长、组件分散和工程复用困难的问题。适合 RAG、Agent、自动化流程和多步骤业务系统开发。
10,infiniflow/ragflow,72400.0,新上榜,RAG / 知识库 / 文档解析,Apache-2.0,这是一个面向企业知识问答和检索增强生成的项目，适合处理文档、知识库、FAQ 和资料问答。它解决的是通用模型容易胡编、企业知识接入困难和文档问答效果不稳的问题。适合内部知识助手、客服问答和资料检索场景。
11,modelcontextprotocol/servers,69800.0,新上榜,MCP Server / MCP 工具链,MIT,这是 MCP 生态中的核心服务端仓库，适合把数据库、浏览器、文件系统和外部服务标准化暴露给模型。它解决的是工具接入不统一、代理难以稳定复用外部能力的问题。适合搭建企业工具层、代理能力扩展和标准化集成场景。
12,zed-industries/zed,67600.0,新上榜,AI 编码助手 / Claude Code 能力增强,GPL-3.0,这是一个现代化编辑器项目，近期开源 AI 编码相关热度较高。它适合把编辑、协作和 AI 辅助结合到同一开发环境中，解决开发体验割裂、反馈慢和协作弱的问题。适合个人开发、团队协作和 AI 辅助编程场景。
13,All-Hands-AI/OpenHands,65200.0,新上榜,AI 编码助手 / Claude Code 能力增强,MIT,这是一个面向“让代理直接上手做开发”的项目，适合让 AI 读取仓库、执行命令、修改代码并完成较长链路任务。它解决的是聊天式模型无法真正落地执行开发任务的问题。适合自动修复、需求实现、测试补全和研发流程自动化。
14,FoundationAgents/MetaGPT,63100.0,新上榜,AI Agent / 工作流编排,MIT,这是一个多角色协同型 Agent 项目，适合模拟产品经理、架构师、工程师等角色一起完成任务。它解决的是复杂项目需要分工、审查和多阶段交付的问题。适合自动研究、软件设计、方案拆解和多代理协同实验。
15,vllm-project/vllm,61100.0,新上榜,LLM 基础设施 / 网关 / 推理,Apache-2.0,这是一个面向大模型高性能推理与服务的基础设施项目，适合把模型稳定地部署成在线服务。它解决的是推理吞吐低、资源利用率差和大模型服务化成本高的问题。适合平台层、推理服务和多模型生产环境。
16,VoltAgent/voltagent,59400.0,新上榜,AI Agent / 工作流编排,MIT,这是一个热度明显上升的 Agent 框架项目，适合快速构建多步骤任务流、工具调用和代理协作能力。它解决的是从零搭建 Agent 系统需要处理太多基础模块的问题。适合内部自动化、研究代理和面向业务任务的执行型助手。
17,microsoft/autogen,57800.0,新上榜,AI Agent / 工作流编排,CC-BY-4.0,这是一个知名的多代理协作框架，适合把多个模型或角色组织起来完成复杂任务。它解决的是单个代理难以同时兼顾规划、执行、审查和工具使用的问题。适合实验多代理系统、业务自动化和复杂任务协作。
18,pydantic/pydantic-ai,56200.0,新上榜,AI Agent / 工作流编排,MIT,这是一个偏工程化的 AI 应用开发框架，适合在 Python 项目里构建类型清晰、结构稳定的 LLM/Agent 系统。它解决的是模型输出不稳定、数据结构难约束和系统难维护的问题。适合服务端 AI 应用、工具调用和生产级代理开发。
19,openai/openai-agents-python,54800.0,新上榜,AI Agent / 工作流编排,MIT,这是一个面向 Python 生态的 Agent 开发项目，适合把模型、工具和任务流组合为可维护的代理系统。它解决的是实验性 Agent 难以工程化、流程难治理的问题。适合后端服务、研究代理和业务系统中的代理层实现。
20,crewAIInc/crewAI,53500.0,新上榜,AI Agent / 工作流编排,MIT,这是一个热门多代理编排框架，适合定义不同角色并让它们协作完成研究、内容生产和流程执行。它解决的是单个代理能力有限、任务难拆解的问题。适合知识工作自动化、团队协作模拟和多角色工作流场景。
21,affaan-m/everything-claude-code,52000.0,下降20,AI 编码助手 / Claude Code 能力增强,未知 / 未声明,这是一个面向 Claude Code、Codex、OpenCode 等 AI 编码工具的“全套工程增强层”。适合团队把技能、命令、记忆、规则和安全检查统一沉淀到同一套仓库里，解决代理写代码时规范不一致、上下文丢失和流程难复用的问题。可用于标准化研发流程、沉淀通用 skills、提升多代理协作和长周期开发稳定性。
22,openclaw/openclaw,51580.0,下降20,自托管 AI 助手 / 本地代理,MIT,这是一个可自托管的个人 AI 助手平台，强调在自己的设备和账户体系中长期运行。适合做个人助理、消息聚合、自动回复、跨应用任务执行等场景，解决“助手分散在多个聊天工具、数据不在自己控制下”的问题。可连接多种沟通渠道和模型能力，把日常问答、提醒、信息收集和轻量自动化集中到一个入口。
23,obra/superpowers,51160.0,下降20,AI 编码助手 / Claude Code 能力增强,MIT,这是一个给 Claude Code 等 AI 编码助手加“工程流程骨架”的技能库。它把需求澄清、设计、实现、测试、评审等步骤串成更稳定的协作流程，适合团队统一开发习惯。适合做长期项目、多人协作和需要规范化交付的研发场景。
24,FujiwaraChoki/MoneyPrinterV2,50740.0,下降20,AI 自动化流程 / 内容或任务流水线,AGPL-3.0,这是一个面向内容变现和增长自动化的项目，核心是把选题、生成、发布和外联等步骤串起来。适合做 AI 内容生产、社媒运营和自动化营销流程，解决内容流水线碎片化、人工重复操作多的问题。适合增长团队、自媒体和自动化内容业务场景。
25,karpathy/autoresearch,50320.0,下降20,AI 工作流 / Agent 编排,未知 / 未声明,这是一个让 AI agent 自动做资料检索、阅读、归纳和实验推进的研究工作流项目。适合做技术调研、论文阅读、竞品梳理和专题分析，解决人工研究速度慢、资料难持续跟进的问题。适合研究团队、咨询分析和知识工作自动化场景。
26,ultraworkers/claw-code,49900.0,下降20,AI 工作流 / Agent 编排,未知 / 未声明,这是一个把编码代理和任务执行流程结合起来的项目，适合在终端里持续推进需求拆解、编码、执行和校验。它解决的是单轮代码生成不够覆盖真实开发链路的问题。适合自动开发、脚本执行和连续任务型编码场景。
27,koala73/worldmonitor,49480.0,下降20,AI 基础设施 / 运行与平台层,NOASSERTION,这是一个偏信息监控和趋势跟踪的项目，适合持续观察外部世界、项目动态和公共事件。它主要解决高频信息变化下人工跟踪成本高的问题，适合研究、运营、投资和情报类场景做持续监测与提醒。
28,msitarzewski/agency-agents,49060.0,下降20,通用 AI Agent / 自主执行框架,MIT,这是一个通用多 agent 协作框架，适合把任务拆成多个角色并让其分工完成。它解决的是单个 agent 在复杂任务中上下文有限、工具能力有限的问题。适合任务编排、角色分工、研究协作和自动化执行场景。
29,garrytan/gstack,48640.0,下降20,AI 工作流 / Agent 编排,未知 / 未声明,这是一个偏 agent 平台化与栈式整合的项目，适合把模型、工具、记忆和任务上下文集中管理。它解决的是 AI 工作流组件分散、流程难维护的问题。适合内部工具平台、运营自动化和跨工具编排场景。
30,78/xiaozhi-esp32,48220.0,下降20,AIoT / 智能硬件,MIT,这是一个让 AI 能力落到 ESP32 等低成本设备上的项目，适合做语音终端、智能硬件、教育设备和轻量边缘助手。它解决的是传统 IoT 设备交互单一、难接入大模型能力的问题。适合开发具备语音与对话能力的硬件原型。
31,gsd-build/get-shit-done,47800.0,下降20,AI 自动化流程 / 内容或任务流水线,MIT,这是一个强调让 AI 真正把事情做完的自动化项目，适合将琐碎但重复的任务串成可执行流程。它解决的是知识工作中很多步骤重复、跨系统、但又不值得长期人工操作的问题。适合任务管理、批量处理、资料整理和运营自动化场景。
32,paperclipai/paperclip,47380.0,下降20,AI 自动化流程 / 内容或任务流水线,MIT,这是一个偏工作流自动化的 AI 项目，适合让模型输出直接连接到真实业务动作，例如整理资料、处理文档和执行规则任务。它解决的是模型“会说不会做”的问题。适合内部工具、办公自动化和业务流程辅助场景。
33,Crosstalk-Solutions/project-nomad,46960.0,下降20,自托管 AI 助手 / 本地代理,MIT,这是一个偏自托管部署的 AI 助手项目，适合在私有环境中搭建可控的智能工作台。它解决的是公有云助手在隐私、定制化和接入内部系统方面的不足。适合内网知识助手、本地实验和企业私有部署场景。
34,VoltAgent/awesome-openclaw-skills,46540.0,下降20,AI 工具与技能清单,未知 / 未声明,这是一个围绕 OpenClaw 技能生态的资源库，适合快速查找可复用 skills、提示模板和自动化经验。它解决的是做代理自动化时“知道要做什么，但不知道现成积木有哪些”的问题。适合平台搭建者和想快速落地自动化的人。
35,moeru-ai/airi,46120.0,下降20,数字人 / 陪伴型 AI,AGPL-3.0,这是一个偏人格化和陪伴型交互的项目，适合做虚拟角色、长期对话、数字陪伴和娱乐型产品。它解决的是通用问答助手缺少人格持续性和互动体验弱的问题。适合虚拟角色运营、陪伴产品和趣味型聊天场景。
36,bytedance/deer-flow,45700.0,下降20,AI 工作流 / Agent 编排,MIT,这是一个面向复杂任务链路的 AI 工作流项目，适合把多步骤任务拆成更稳定、可观测的流程节点。它解决的是长链路 agent 容易失控、难治理的问题。适合内部流程自动化、研究流程和内容处理型系统。
37,volcengine/OpenViking,45280.0,下降20,Agent 记忆 / 长上下文记忆,Apache-2.0,这是一个为 AI agent 增强长期记忆和上下文管理能力的项目。它解决的是模型天然短记忆、容易忘记历史偏好和任务状态的问题。适合长期助理、持续项目协作和带历史状态的代理系统。
38,VoltAgent/awesome-design-md,44860.0,下降20,面向 AI 编码的设计系统 / UI 规范,未知 / 未声明,这是一个沉淀设计规范和 DESIGN.md 资源的项目，适合让 AI 在生成界面和前端代码时更贴近既有设计语言。它解决的是 AI 生成界面风格漂移、实现不一致的问题。适合设计到开发协同和前端 AI 生成场景。
39,firecrawl/firecrawl,44440.0,下降20,Agent 抓取 / 外部信息收集,AGPL-3.0,这是一个为 LLM 和 agent 场景优化的网页抓取与抽取项目，适合做网页采集、知识库构建和自动研究。它解决的是普通爬虫输出不适合模型消费的问题。适合做 RAG 数据准备、竞品监控和外部情报采集。
40,microsoft/VibeVoice,44020.0,下降20,AI 语音 / 语音生成与识别,MIT,这是一个聚焦语音生成和语音交互体验的项目，适合做语音助手、内容配音和可听化产品。它解决的是纯文本交互不自然、人工配音成本高的问题。适合语音对话、数字人配音和多风格语音输出场景。
41,anthropics/skills,43600.0,下降20,Agent 技能包 / Prompt 与工具集合,未知 / 未声明,这是一个面向 AI 助手的技能集合仓库，适合把常见任务模式、工具使用方法和执行规则沉淀成复用组件。它解决的问题是每次都从零写 prompt 和流程，难以复制优秀做法。适合构建团队技能库、标准化常见任务和快速扩展代理能力边界。
42,rtk-ai/rtk,43180.0,下降20,AI 基础设施 / 运行与平台层,Apache-2.0,这是一个偏 AI 平台和运行时能力的基础设施项目，适合做模型调用抽象、服务集成和 AI 应用底座。它解决的是模型、工具、接口和部署方式分散的问题。适合平台团队做统一接入层和共享能力底座。
43,shareAI-lab/learn-claude-code,42760.0,下降20,AI 编码助手 / Claude Code 能力增强,未知 / 未声明,这是一个面向 Claude Code 学习和最佳实践的项目，适合想快速提升 AI 编码效率的人。它解决的是工具能力强但使用方法不稳定的问题。适合个人学习、团队培训和规范化上手 Claude Code 的场景。
44,HKUDS/CLI-Anything,42340.0,下降20,AI 自动化流程 / 内容或任务流水线,MIT,这是一个让 AI 更稳定调用命令行工具和系统能力的项目，适合把自然语言任务转成可执行的 CLI 流程。它解决的是模型会理解任务但不会可靠调用底层环境的问题。适合开发辅助、自动运维和批量系统操作场景。
45,googleworkspace/cli,41920.0,下降20,Agent 技能包 / Prompt 与工具集合,Apache-2.0,这是一个把 Google Workspace 能力接入自动化流程的项目，适合处理邮件、文档、表格和日程。它解决的是办公 SaaS 操作碎片化、重复劳动多的问题。适合做办公自动化、文档处理和报表整理场景。
46,shanraisshan/claude-code-best-practice,41500.0,下降20,AI 编码助手 / Claude Code 能力增强,MIT,这是一个专注 Claude Code 使用方法和工程实践的项目，适合团队沉淀 AI 编码 SOP。它解决的问题是同一个工具在不同人手上效果差异很大，缺少统一方法论。适合做规范沉淀、入门培训、研发工作流升级和常用提示模板复用。
47,Panniantong/Agent-Reach,41080.0,下降20,搜索 Agent / SEO / 发现,MIT,这是一个偏信息发现与搜索触达的 Agent 项目，适合做 SEO、内容发现、信息触达和目标搜索。它解决的是人工搜索覆盖面有限、效率低和难以持续跟踪的问题。适合增长、运营、线索发现和主题研究等需要广泛信息捕获的场景。
48,AstrBotDevs/AstrBot,40660.0,下降19,聊天机器人 / 角色陪伴,AGPL-3.0,这是一个面向聊天平台和多渠道接入的机器人项目，适合在 IM 平台中构建 AI 对话助手、娱乐机器人或群聊助手。它解决的是聊天入口分散、机器人功能单一和跨平台维护成本高的问题。适合社区运营、群助手、私聊问答和角色聊天类产品。
49,nextlevelbuilder/ui-ux-pro-max-skill,40240.0,下降19,面向 AI 编码的设计系统 / UI 规范,未知 / 未声明,这是一个面向 UI/UX 设计产出与 AI 协作的 skill 项目，适合把设计需求、组件规范和页面实现经验沉淀下来。它解决的是 AI 生成界面容易“能看不能用”、缺少一致性的问题。适合前端团队、独立开发者和产品设计人员在 AI 协作中提高交付质量。
50,qwibitai/nanoclaw,39820.0,下降19,Agent 记忆 / 长上下文记忆,MIT,这是一个轻量级 Agent 记忆系统项目，适合给代理增加可持久化的用户偏好、任务历史和上下文记忆。它解决的是模型每次会话都“从零开始”，无法形成连续工作关系的问题。适合个人助手、长期陪伴、项目管理和跨天任务追踪等场景。
51,tobi/qmd,39400.0,下降19,搜索 Agent / SEO / 发现,MIT,这是一个偏内容组织、发现和结构化呈现的项目，适合处理搜索结果、资料汇总和信息发现后的再组织。它解决的是信息搜到了但难以沉淀、难以形成可读成果的问题。适合知识整理、研究助手和面向内容工作者的工作流构建。
52,santifer/career-ops,38980.0,下降19,AI 求职 / 简历与职业运营,MIT,这是一个把 AI 用于求职与职业运营的项目，适合简历优化、岗位分析、申请流程管理和职业材料生成。它解决的是求职信息分散、材料重复改写和投递流程繁琐的问题。适合应届生、转岗人群和需要批量管理岗位申请的人使用。
53,nikopueringer/CorridorKey,38560.0,下降19,AI 图像编辑 / 修图,未知 / 未声明,这是一个面向图像编辑或视觉后处理的项目，适合做素材增强、细节修改、风格统一和自动后期。它解决的是传统修图流程重手工、重复调整多的问题。适合内容制作、设计团队和需要快速批量处理图片素材的场景。
54,milla-jovovich/mempalace,38140.0,下降19,Agent 记忆 / 长上下文记忆,未知 / 未声明,这是一个偏长期知识记忆与结构化回忆的项目，适合让 AI 保存重要事实、偏好、任务脉络和知识片段。它解决的是代理长期使用后仍无法稳定“记住你”的问题。适合做陪伴助手、客户服务、研究记录和长期项目协作型 Agent。
55,siddharthvaddem/openscreen,37720.0,下降19,视频制作 / 演示视频生成,MIT,这是一个偏演示、录屏和视频表达的项目，适合做产品讲解、操作演示、培训视频和轻量视频内容制作。它解决的是视频说明成本高、演示录制流程分散的问题。适合产品团队、培训团队和独立创作者快速生成清晰的可视化说明内容。
56,calesthio/Crucix,37300.0,下降19,监控 / 趋势跟踪代理,未知 / 未声明,这是一个面向趋势变化检测和持续监控的项目，适合追踪外部世界、市场、竞品或系统状态变化。它解决的问题是大量变化信号混杂，人工难以及时识别真正重要的波动。适合研究、运维、运营和情报场景做持续追踪与异常提醒。
57,jundot/omlx,36880.0,下降19,本地 LLM / 本地推理,Apache-2.0,这是一个偏本地模型运行和轻量推理体验的项目，适合在个人电脑或本地环境中部署大模型能力。它解决的是云端调用成本、延迟和隐私顾虑较高的问题。适合离线使用、本地实验、隐私敏感业务和边缘设备上的模型推理场景。
58,D4Vinci/Scrapling,36460.0,下降19,Agent 抓取 / 外部信息收集,MIT,这是一个用于网页抓取和信息抽取的工具项目，适合给 Agent 提供稳定的数据采集能力。它解决的是网页结构复杂、反爬规则多、原始 HTML 不适合直接进入模型的问题。适合做数据采集、竞品监控、研究准备和知识库原始数据构建。
59,hacksider/Deep-Live-Cam,36040.0,下降19,AI 视频生成 / 自动剪辑,MIT,这是一个偏实时视频处理、换脸或直播效果增强的项目，适合做直播互动、视频特效和实时视觉处理。它解决的是传统视频后期不能实时反馈、制作门槛高的问题。适合娱乐直播、互动演示、视觉实验和内容制作场景。
60,TauricResearch/TradingAgents,35620.0,下降19,量化 / 金融 AI 代理,MIT,这是一个把 Agent 能力用于金融研究和交易分析的项目，适合做市场信息汇总、研究辅助和策略讨论。它解决的是金融分析信息量大、变化快、手动整理效率低的问题。适合量化研究、投资研究和金融数据分析团队构建研究型助手。
61,openai/symphony,35200.0,下降19,AI 自动化流程 / 内容或任务流水线,Apache-2.0,这是一个强调多角色协同和复杂任务编排的 Agent 系统，适合把一个较大的业务目标拆成多个阶段，让不同角色代理分工完成。它解决的是单个 Agent 在复杂任务中规划不足、执行不稳定的问题。适合研究流程、内容生产、复杂业务自动化和需要多阶段控制的工作流。
62,fishaudio/fish-speech,34780.0,下降19,文本转语音 / TTS,Apache-2.0,这是一个文本转语音项目，适合做播报、配音、角色语音和交互式语音输出。它解决的是人工录音成本高、语音风格切换慢、批量语音生成困难的问题。适合内容创作、语音助手、教育产品和数字人语音输出场景。
63,ZhuLinsen/daily_stock_analysis,34360.0,下降19,量化 / 金融 AI 代理,MIT,这是一个面向日常股票分析和资讯整理的 AI 项目，适合做市场简报、个股跟踪和研究辅助。它解决的是普通投资者每天需要在大量资讯与指标中筛重点的问题。适合构建日更分析助手、投资情报摘要和金融观察类自动化流程。
64,NousResearch/hermes-agent,33940.0,下降19,通用 AI Agent / 自主执行框架,Apache-2.0,这是一个通用自主代理框架，适合构建能独立规划、调用工具和执行任务的 AI 系统。它解决的是普通聊天模型无法长期自主推进任务的问题。适合做自动研究、任务执行、工具链编排和通用型 AI 助手系统。
65,thedotmack/claude-mem,33520.0,下降19,Agent 记忆 / 长上下文记忆,MIT,这是一个为 Claude Code 或类似编码代理补充长期记忆能力的项目。它解决的是代理在跨文件、跨任务和跨天开发中容易忘记约定与历史背景的问题。适合做长期开发助手、维护大型代码库、记录工程上下文和沉淀团队开发记忆。
66,agentscope-ai/CoPaw,33100.0,下降19,聊天机器人 / 角色陪伴,Apache-2.0,这是一个偏互动式对话和陪伴体验的项目，适合构建角色聊天、宠物型助手或具有持续互动感的 AI 产品。它解决的是通用问答模型情感表达弱、互动粘性不足的问题。适合娱乐化产品、陪伴型应用和长期用户关系维护场景。
67,karpathy/nanochat,32680.0,下降19,聊天机器人 / 角色陪伴,MIT,这是一个轻量化聊天系统项目，适合快速搭建实验型对话产品和本地聊天界面。它解决的是很多对话系统过重、难以作为教学或实验起点的问题。适合做学习样例、快速原型、本地聊天工具和轻量 AI 前端。
68,HKUDS/nanobot,32260.0,下降19,聊天机器人 / 角色陪伴,MIT,这是一个轻量机器人或助手型项目，适合快速做聊天接口、任务型机器人和小型 AI 服务。它解决的是从零搭聊天机器人仍需要接很多基础设施的问题。适合教学、原型验证、小团队工具化和轻量自动回复场景。
